lead_id,created_at,label_namespace,company,contact,channel,source_url,segment,problem_hypothesis,offer,status,last_touch,next_action,follow_up_date,evidence_uri,notes
C10K-000,2026-05-08,Codex10k,Internal,,,,,Run setup,10-Day Workflow Revenue Recovery Sprint,initialized,2026-05-08,Begin fresh lead sourcing,,docs/research.md,Do not mix with prior Revenue Run labels
C10K-001,2026-05-08,Codex10k,Creative Fabrica,,Greenhouse / Reddit,https://job-boards.eu.greenhouse.io/creativefabrica/jobs/4807276101,Ecommerce / marketing ops,"Needs AI workflows for email operations, content pipelines, campaign execution, optimization, and HITL governance",Workflow Revenue Recovery Sprint,hold_employment_style,2026-05-08,"Do not apply as a job; pursue only if a fixed-scope vendor/project contact path appears",2026-05-09,docs/opportunity-log.md,"Recent public job post but requires personal application details and likely employee-style involvement"
C10K-002,2026-05-08,Codex10k,GCS,mohammed.k@gc-ti.com,Public hiring email,https://community.n8n.io/t/hiring-we-are-looking-for-a-n8n-automation-expert-to-build-ai-agent-workflows-freelance/132551,AI workflow / document automation,"Asked for n8n multi-agent workflow developer to ingest and analyze documents and generate downstream AI prompts",10-Day Workflow Revenue Recovery Sprint,contacted_fixed_scope,2026-05-08,"Watch for reply; if positive, request anonymized sample docs and scope paid triage",2026-05-10,gmail:19e08e71637b72c1,"Clarified this is not employment; Codex10k offers a done-for-you fixed-scope build"
C10K-003,2026-05-08,Codex10k,Talents Team,,Make Community,https://community.make.com/t/hiring-make-com-http-make-com-automation-engineer-contract-part-time/103508,Automation contractor,"Needs Make scenarios, routers, scheduling, error handling, APIs, data mapping, docs, troubleshooting",Workflow Triage,qualified,2026-05-08,"Apply via Make Community DM if account access is available",2026-05-09,docs/opportunity-log.md,"No direct email visible; avoid scraping or bypassing platform"
C10K-004,2026-05-08,Codex10k,Creative Fabrica Reddit poster,,Reddit,https://www.reddit.com/r/n8n/comments/1t49b3r/hiring_ai_marketing_specialist_agentic_ai/,B2C marketing automation,"Poster confirmed freelancers may be considered if similar timezone and experience at needed scale",Workflow Triage,hold_employment_style,2026-05-08,"Do not apply as job; only pursue if vendor/project path appears",2026-05-09,docs/opportunity-log.md,"Do not message via bots or scraped contact data"
C10K-005,2026-05-09,Codex10k,Callee AI Solutions,CalleeAIsolutions@gmail.com,Skool public post,https://www.skool.com/brendan/hiring-n8n-automation-engineer,Voice AI agency automation,"Agency has client surge and needs n8n/API automation layer for bookings, outreach, lead gen, and internal ops",10-Day Workflow Revenue Recovery Sprint,contacted_fixed_scope,2026-05-09,"Watch for reply; if positive, request anonymized input/output and scope paid milestone",2026-05-11,gmail:19e08eb2da5715f2,"Sent done-for-you fixed-scope build offer; no employee-role framing"
C10K-006,2026-05-09,Codex10k,Strive Digital,bruno@strive-digital.com,LinkedIn public post,https://br.linkedin.com/company/strivedigitall,Outbound lead-gen / data ops,"Needs main database plus per-client sheet workflow with duplicate prevention and client-specific statuses",10-Day Workflow Revenue Recovery Sprint,contacted_fixed_scope,2026-05-09,"Watch for reply; if positive, request anonymized main DB and 2 client sheets",2026-05-11,gmail:19e08eb918b791a3,"Sent fixed-scope project proposal around their exact data synchronization problem"
C10K-007,2026-05-09,Codex10k,Bluestork AI,contact.bluestork.ai@gmail.com,Reddit public post,https://www.reddit.com/r/n8n/comments/1nnhboj,AI floor-plan workflow,"Wants n8n workflow for contractors to upload floor plans and receive structured room/surface measurements",10-Day Workflow Revenue Recovery Sprint,contacted_fixed_scope,2026-05-09,"Watch for reply; if positive, request 2-3 anonymized floor plans and target output format",2026-05-11,gmail:19e08ebf205599ce,"Sent fixed-scope milestone offer for upload/extraction/review/output workflow"
C10K-008,2026-05-09,Codex10k,Shilling Strategy Consulting,keerthivasan@shillingstrategyconsulting.com,LinkedIn public post,https://in.linkedin.com/company/shilling-strategy-consulting-ssc,Consulting / workflow automation,"Public post asked for N8N automation freelancer with workflow integrations and scalable automation systems",10-Day Workflow Revenue Recovery Sprint,contacted_fixed_scope,2026-05-09,"Watch for reply; if positive, request one workflow plus 5-10 sample records/screenshots",2026-05-11,gmail:19e08ec44f776529,"Sent done-for-you fixed-scope build offer with demo link"
C10K-009,2026-05-09,Codex10k,RestaurantFlow OS,heldermiranda96@gmail.com,n8n Community public post,https://community.n8n.io/t/hiring-automation-engineer-wanted-n8n-core-role-restaurant-tech-startup/292053,Restaurant revenue automation,"Needs production n8n workflows for OpenTable/SevenRooms booking data, Supabase, GHL, Printnode, multi-tenant idempotency, HMAC validation, and error handling",Fixed-scope RestaurantFlow workflow build,contacted_fixed_scope,2026-05-09,"Watch for reply; if positive, request smallest workflow group, payload examples, and Supabase table shape",2026-05-11,gmail:19e08f2811f81844,"Sent USD 2500 fixed first-workflow-group offer; framed around test environment and acceptance checks"
C10K-010,2026-05-09,Codex10k,SPAudio,tech@spaudio.it,n8n Community public post,https://community.n8n.io/t/seeking-experienced-freelance-n8n-automation-expert/207669,Audio / operational automation,"Needs freelance support for self-hosted n8n setup, production workflows, complex API integrations, daily support, and optimization",n8n stabilization sprint,contacted_fixed_scope,2026-05-09,"Watch for reply; if positive, request top failing workflow, apps/APIs involved, and hosting mode",2026-05-11,gmail:19e08f2a422b2929,"Sent USD 1800 fixed stabilization package offer for one priority workflow/integration plus operator guide"
C10K-011,2026-05-09,Codex10k,PristinePro Technologies,careers@pristineprotech.com,Reddit public post / company site,https://www.reddit.com/r/n8n/comments/1p03o0g/looking_for_n8n_developer_with_2_years_of/,AI automation consultancy,"Public post asked for n8n AI agent help; company site shows AI automation work around transcription, media processing, and document updates",Fixed-scope n8n AI agent build,contacted_fixed_scope,2026-05-09,"Watch for reply; if positive, request one workflow and 5-10 anonymized sample records/screenshots",2026-05-11,gmail:19e08f2c2d25180a,"Sent USD 1500-2500 fixed workflow offer; no employee-role framing"
C10K-012,2026-05-09,Codex10k,Noevo,io@noevo.io,LinkedIn public post / company site,https://lk.linkedin.com/jobs/view/n8n-%2B-ai-automation-assistant-part-time-at-noevo-io-4347043760,EdTech operations automation,"Public posting described n8n and AI automation needs for AI-powered student counselor platform; site shows application support and document checklist workflows",Fixed-scope Noevo operations workflow build,contacted_fixed_scope,2026-05-09,"Watch for reply; if positive, request one workflow and anonymized input/output examples",2026-05-11,gmail:19e08f2e136045e9,"Sent USD 1500 fixed workflow offer for intake, checklist, routing, reminders, or reporting"
C10K-013,2026-05-09,Codex10k,MJBLAW,jshenkar@bernllp.com,n8n Community public post,https://community.n8n.io/t/law-firm-is-looking-for-fractional-support-in-n8n/264725,Legal operations automation,"Law firm asked for fractional support developing and maintaining Monday.com workflows, n8n automations, operational efficiency, and integration projects",Fixed-scope Monday.com + n8n legal-ops workflow,contacted_fixed_scope,2026-05-09,"Watch for reply; if positive, request one manual/fragile workflow, Monday.com board structure, and anonymized records",2026-05-11,gmail:19e08fa5b32c3037,"Sent USD 1500-2500 fixed one-workflow offer with confidentiality and data-minimization framing"
C10K-014,2026-05-09,Codex10k,BoviC,borhanovic11@gmail.com,n8n Community public post,https://community.n8n.io/t/looking-for-n8n-expert-accounting-automation-saudi-vat/264293,Accounting automation,"Asked for n8n expert to build Saudi VAT accounting automation system",Fixed-scope accounting ingestion-to-review workflow,contacted_fixed_scope,2026-05-09,"Watch for reply; if positive, require approved VAT rules, anonymized samples, and explicit no tax/legal advice boundary",2026-05-11,gmail:19e08fa8fbc3903d,"Sent USD 2500 fixed technical automation milestone; stated Codex will not certify tax/ZATCA compliance"
C10K-015,2026-05-09,Codex10k,El Wong AI startup,elwongyvr@gmail.com,n8n Community public post,https://community.n8n.io/t/now-hiring-operations-pm-for-ai-startup/294087,Startup operations automation,"Fast-growing AI startup needs delivery, onboarding, team coordination, process docs, systems audits, and implementation plans around Notion, Airtable, and ClickUp",Fixed-scope ops workflow build,contacted_fixed_scope,2026-05-09,"Watch for reply; if positive, request one onboarding/delivery workflow and anonymized input/output examples",2026-05-11,gmail:19e08faaff62fd56,"Sent USD 1500 fixed implementation slice offer; explicitly not a full-time PM application"
